comment,stance,reason,explanation
"それ結構風評被害だと思うんだよな
近所にスシローとくら寿司があるんだけど、その政治評論家が嫌いだからくら寿司選んでるくらいだし",neutral,,風評被害の比喩を使い、立場表明していない
ウヨ的には「サナ流石のカウンター」「切り返し、すごい」「野田代表は痛い所を思いっきり突かれた」らしいw,support,leadership,高市氏を「流石」と評価し、切り返しを称賛
">>509
ウクライナとワクチンなんかにムダ金垂れ流しにしときながら財源ない増税とかホント笑うな",oppose,other_reason,高市氏の増税主張に対して不満を表明
">>514
少しはニュースくらい見たら？
こんな中国人が高市叩きに必死なとこにずっといたら認知歪むだけだぞ",support,other_reason,中国が高市を叩くと非難し擁護
>>494 自民党の支持率は石破政権当初よりも低いし、選挙で高市支持者が岩屋とかに投票するかよって話だよね,oppose,political_ideology,高市での支持拡大を疑問視
"いや、上がってるのかおまえに聞いてるんだぞ
下がってるぞ",neutral,other_reason,文脈が曖昧で立場不明
>>520 そりゃ違う言葉だよｗ そんなこと否定してないよｗｗｗ やっぱり君の社会復帰への道は遠いねｗｗｗ あわれなｗ もうこの際、ちゃんとご両親に「生まれてきてごめんなさい」って謝っとけｗｗｗ,oppose,other_reason,高市氏個人を差別的・人間的に攻撃している
安倍「こんな人たち」 小池「排除します」 本人の真意がどうであれ言葉一つで長引くダメージを負う事もあるが 現状，高市に対する否定意見は中国と組んでやってんだろって流れになるから平気そう,oppose,political_ideology,政治的対立を中国と結ぶ流れとして描いて批判
毎回高市の介護させられて可哀相ではある,oppose,leadership,高市氏を批判的に描写し、指導力を疑問視
"高市は大臣の時も追及にキレてもう質問しないでと言い放ったヒス女だからな
そんな事よりもなら少しは成長したんじゃねえの",oppose,leadership,高市氏の非難とヒスを批判
>>527 お前敗北を認めたかよw このクソがさっさと死に絶えろ お前が生活するだけで税金の無駄だわ,oppose,leadership,高市氏への人格攻撃と公務員としての価値否定
何言ってるの 独裁女の 火消しにならんわ,oppose,leadership,『独裁女』との差別的表現で指導力を否定
"中国叩いてりゃ支持率簡単に上がるんだから簡単な仕事だよな
政治力最低",oppose,leadership,政権運営能力の低さを直接批判
xで高市が何言っても何やってもネトウヨは称賛するって言われてたのが面白かったな うんこ踏んでも称賛するんだろって,oppose,other_reason,高市を風刺的に評価し批判
そんなことよりなんて言わせた野田が悪いギャオオオオオオン！,support,leadership,高市氏の発言は正当な話題転換として支持
"政治力は田母神レベルの無能
でも女性と言うことと中国叩いてりゃ支持率上がるのでw
経済音痴外交音痴でもな
つまり国民が大アホなんだよな",oppose,leadership,政治力と指導力を直接的に批判
もうほんとこんなことばっかりやってる場合じゃないんですよ,oppose,leadership,政治改革の重要性を指摘し、リーダーの判断を否定
"発言の全てが軽薄なんだよこの人
作り笑顔も",oppose,leadership,人柄に対する否定的評価
"ディベートで、売り言葉に買い言葉で追い込まれると
苦し紛れの言葉を発する、
それが日本を危険な状態にすることも理解できずに
無能すぎて政治家の適正ゼロ",oppose,leadership,政治家としての能力欠如を批判
人をキレさせる才能があるよね,oppose,leadership,高市氏の発言が周囲を傷つけると評価
失言ババア,oppose,leadership,高市氏を貶す表現で資質批判
"言葉のカルト化：多文化共生
現時点でこれを言い出すやつらは信用してはならない
思考停止者か情弱か、工作員か特定の主義への癒着かである",oppose,political_ideology,他の政治的主張として「多文化共生」という理念に否定的
日本叩いて支持率上げてるどっかの国みたいだな ついに日本もそちら側の仲間入りしちゃったのね,oppose,political_ideology,他国攻撃を指摘し、政権側の行動・イスラエル論調を利用
"つか、とにかく要人と並んで笑顔作ってカメラに収まりゃ勝利、って感じよねｗ
まるで場末のキャバクラ嬢みたいだわｗ",oppose,leadership,高市氏の姿勢を厳しく批判
そんなことよりも戦争やりましょう,oppose,political_ideology,戦争提案は保守思想と無関係で、歪んだ政治的主張と判断
ババア考えなしに好き勝手言ってるだけじゃねえか,oppose,leadership,高市氏への人柄否定で指導力批判
この人あんま頭良くないんじゃないのか？相手がチンジローだからマシに見えただけで,oppose,leadership,高市氏の知能・判断力に疑問を呈しています
でも国民の大半は国会なんて見てないし発言内容にも興味がないから今後、物価や米価が下がるか、保有NISAなどが上がるかで判断するだろうね政権発足後、65％程度と高い支持率は維持してるそうだからみんなが様子見なのか,neutral,neutral,高市氏への支持/批判を表明せず、国民心理を述べただけ
">>547
え？
まさか今頃気付いたのか……？ｗ",neutral,other_reason,皮肉は含まれるが主張が不明確
最後にゆってるしまあ,neutral,neutral,態度表明なし、曖昧な表現
まあこれだけネット扇動型の大衆政治が蔓延してしまうと高市さんがやめたところでまともな宰相が登ってくることはないだろうな 登場したところでひたすら根拠の薄いネガキャンされるだけし,oppose,leadership,ネット扇動で正しさが決まり、優れた政治家は報われないという批評
"これが失言にならないんだから無敵
討論でそんなことよりって聞いてる人を馬鹿にしすぎだよ",oppose,leadership,相手を馬鹿にする発言は指導力の欠如
>>18 どっちも重要だよね,neutral,neutral,両論併記で優劣判定不可
みんなばかではないんだ,oppose,leadership,高市の発言が愚かだと批判
"なってないとかなんで思うんだ……ｗ
もう全く意味不明だなｗ",oppose,leadership,高市氏の発言を無意味だと批判
ここまでの華麗な話題逸らしは歴代首相でも見たことない,oppose,leadership,話題逸らしが下手だと批判
"自民はやはりどこまで行っても自民
さっさと下野してもらうしかない",oppose,political_ideology,自民党への否定的見解と下野要求
>>547 頭悪いかはともかく感情的になりやすいから駆け引きは苦手 人付き合いも線引きしがち,oppose,leadership,感情的で駆け引きが苦手と指導力に否定
とりあえずトリプル安の状態から抜け出さないと内閣支持率は下がり続けると俺は予想するけど,oppose,leadership,内閣の対応不足を批判
>>551 既にそうやって首相辞めさせて行った結果 一番あかんヤツまでお鉢が回って来たのよ,oppose,political_ideology,「一番あかんヤツ」と批判し、政権批判の趣旨
そんなことよりも原子力潜水艦はどうなった？,oppose,other_reason,定数削減以外の政策問題を指摘
政治家になるやつはディベートの基本的なトレーニングくらいしておけよ 官僚のペーパー読み上げマシンだしアホ丸出しなんよな,oppose,leadership,ディベート訓練不足・アホと批判
これでも小野田に比べたら何倍もマシ あっちは顔と態度に出すぎ,support,leadership,小野田を批判し、高市を上回る人物として評価
こんな感じで外国相手にもやらかし続けるぞ。とにかく言葉が軽すぎ,oppose,leadership,言葉の軽さを指摘し指導力に疑問
こんな田舎のヤンキーみたいなのよく自民党総裁になれたな　　日本人は馬鹿が多い証明,oppose,leadership,高氏を最適でない人物と貶している
釈明になってなくね？結局話題そらしたかったって白状してんじゃん,oppose,leadership,話題転換の意図を否定せず批判
">>548
国会見てる人は見てる人で立民が相手にする価値もないただのゴミなのは分かるし
叩いてるのは叩き目的で都合のいい切り取り記事を見てるやつばかり",support,political_ideology,立民を否定し、自身が批判的立場を表明。
揚げ足取りして邪魔するしか出来ないんだろうな 支持率高いから,oppose,oppose,高市氏を批判する内容。支持率を軽視する表現
そんなことよりも、で正しいだろw,oppose,leadership,態度を批判し、話題転換に不快感を示している
まあ総理になってからの言動を見たら高市さんは駄目だと三下り半を突き付けた安倍は正しかった,oppose,leadership,高市氏の指導力を否定し、安倍氏の判断を支持
ヘタクソか,oppose,leadership,高市氏の対応を「ヘタクソ」と批判
">>567
それじゃ国会見る意味なくね？",oppose,leadership,国会討論の意義を否定し、政治家に対し不信を示している
">>521
サジェスト汚染は酷いよな
昼めし時とかとくにひるおびのせいで創価スパイ自民広報のクソジジイのネタと普通にすき家のスシローの話とがXで混ざってる",neutral,neutral,高市氏批判を含まない中立的文脈
"まあ国民の大半は情報がまだ出てないから様子見なんだと思うよ
とりあえず御祝儀相場高支持率になったのは
・女性初の総理　・トランプとの仲は良好　・株価が高騰　・ガソリン安となった
これが理由だろう。でも株価は急落してるから次回は確実に支持率下がると思う。
米価もかつてない高騰を続けてるし。",neutral,other_reason,高市氏支持か批判の明示はなく、支持率要因と予測を述べているのみ
"木原稔さんずっと総理の火消し担当しかしてなくて草
鳩山由紀夫に振り回された
平野博文官房長官の気持ちがよく分かったろう",oppose,leadership,木原官房長官を批判している
"本人が言うならまだわかるけど
なんだそりゃ",oppose,leadership,本人の発言でも理解不能と批判
>>574 原油価格が4年半ぶりの安値にしては円安効果で打ち消しになってそこまで値下げに繋がってないのほんとひで,neutral,neutral,原油価格と円安の経済現象に関する事実叙述
"党内議員がネットで信者から猛攻撃されるのを恐れて物申せなくなってるらしい
ある意味恐怖政治になってる",oppose,leadership,党内の自由な発言が阻害されている点を批判
"そんなことより
本人が釈明しろよ",oppose,leadership,高市氏自身の責任逃れを批判
>>578 時々しか見てないけどテレビなんかもかなり批判は控えてる印象だわ,neutral,other_reason,受動的なテレビ視聴の感想で、高市氏批判はない
"そんなことよりいっしょにぴょんぴょんしましょう
でもよかったんじゃないかな",neutral,other_reason,文脈が曖昧で明確な立場がない
"野田と高市のどっちが総理かわからない酷い答弁
こういうのが続くとさすがに大丈夫か？？ってなってくる",oppose,leadership,総理の判断力・責任感が問われている
"世界初！女性独裁者！
いいね",support,leadership,女性独裁者と称し支持している
">>578
ネット内では無敵の人々だからな
何を言っても通じないから誰でも相手にしたくないだろう",oppose,leadership,高市氏が世論に接受されない存在と批判
>>582 野田佳彦あれでも相当手加減してる方だしな,oppose,political_ideology,野田氏への批判を含む右傾視点
急いで話題を転換するのもおかしいだろ 聞かれたことに答えてないし,oppose,leadership,政治的対応として不適切とした
こんな失言の多い人に外交やらせて大丈夫なの？通訳が上手いこと翻訳してくれればいいけど,oppose,leadership,失言を理由に指導力に疑問を呈
"とりあえず物価対策だけは真面目にやった方がいいと思うよ
そこだけちゃんとやれば国民の大半は評価するから。今のままだと確実に
支持率は激減する。",oppose,political_ideology,高市氏の政策重点の誤りを批判
へぇ、裏金はそんなことなんだ（へー）,oppose,leadership,高市氏の発言を軽視していると批判
">>587
現在進行系で大丈夫じゃないだろ😂",oppose,leadership,文脈から高市氏の対応を不適切と批判
">>587
米国連邦何ちゃらにお勤めしてから英語はペラペラだって保守の人が言ってたから通訳いなくてもへーきへーきw",oppose,other_reason,高市氏の英語能力を皮肉って批判
"無理です、毎年インフレ税を受け入れてください
国民に知らず知らずの間にインフレ税を負担させ、GDP比の国債発行残高を減らすことが目標だと
腹を括れとメッセージが通達されたでしょう",neutral,neutral,政治家への評価ではなく法制度批判
これが全体の2割程かと思うと凄い頑張ってるな,support,leadership,頑張ってるという肯定的評価
"っていうかさあ、それ本当なのかねえ？ｗ
でもさ、確か総裁選ではさあ、なんか候補者そろってのイベントかなんかで、英語で答えてください、という質問に
高市早苗は自分で「わたしは英語ができないので…」って、なんかスローガンみたいな2語くらいで答えてたよなあ？ｗ
……もしかして、それも職歴詐称なんじゃ……？",oppose,leadership,知能・能力への信頼懐疑を表明
今の自民で増税出来る人材は高市しかいないだろうな,support,leadership,高市氏の政策能力を称賛
"いや、そんなのどんなバカでも出来ると思うが？ｗｗｗ
それとも面の皮の厚さの話かなんかなの？ｗ",oppose,leadership,高市氏の発言を皮肉り、指導力欠如を示唆
次に進次郎が首相になったら日本はお笑い大国を目指すしかなくなる,oppose,leadership,進次郎氏のリーダーシップを否定的に評価
"野田は松下政経塾の後輩だからか全然鋭さが無かったから高市も気が緩んでそんな事よりもなどと口を滑らせたんだろ
山本太郎に1時間ほど与えてみろ
高市が顔を歪ませて何も言えなくなるだろうから",oppose,leadership,高市氏の指導力・筋が弱いと批判
それよりも基地害虫パヨ駆除しようぜ,oppose,political_ideology,政治風刺で高市氏の政策転換を批判
>>580 「支持率を下げてやる」騒動から変わったような気がする 昔統一教会問題の報道に信者がクレーム攻撃してから安倍事件まで報道が止まった。攻撃最後に起こった朝日の記者殺害の新聞記事に流れが書いててその記事のスクショをXで見た それが成功体験になってるのでは。という話だった,neutral,other_reason,高市氏特定の立場表明なし
なんで急ぐ必要があったの,neutral,other_reason,急ぐ必要性を疑問視するが、立場表明ではない
"いや、それを言うなら、大陸8割発言のところで変わった、というか化けの皮が剥がれたというかｗ
もっと言うなら、総務省怪文書事件でも、結局お咎めなしだもんねｗこれなんかも「成功体験」じゃないのかなｗ",oppose,leadership, Tenant-like behavior indicating she is not blameless
いずれやります、そんなことより、それでもダメならナショナリズムですよ！,support,political_ideology,ナショナリズムを明言し、政治的背景を論じたため
"自民の不記載は裏金
野党の不記載はただのミス
これが政治と金問題",oppose,criticism_validity,自民と野党の対応に差別を指摘
>>595 まあトラス高市の後に、誰がスナク役を引き受けるかでしょう考えるのは,oppose,leadership,「スナク役」と即ち批判を指し、指導力に疑問を呈
いや、もう自民党と財務省がいるかぎり、日本は女衒立国を目指すしかないぞ？ｗ そのうち立ちんぼ保護法案を提出するに違いないｗ,oppose,political_ideology,高市氏や与党への批判を含む右翼的表現で反対
"いや、だから、そもそも「政治とカネ問題」って言い方自体が、不当な「問題の一般化」であり、
まさに誤魔化しなんだよねｗ
どう見ても「自民党とカネ問題」だからな？ｗｗｗ",oppose,political_ideology,与党批判を含む政治的否定を表現
"そんなことよりもって敵を作ったり信用されなくなったり友達減らす言葉
私生活でも家族以外はあんまり使わない
面倒な物事や相手を遠ざけたい時にわざと使ったりもする
ただ時と場面を相手を選ばないと喧嘩になる事もある",oppose,leadership,言葉遣いが不適切で人間関係を損なうと批判
"つか、岸田なんか「金がなくても政治ができるなんて綺麗事は言わない」とか開き直ってたもんなあ？ｗ
あれにも呆れちゃったよｗｗｗ
金で政治する、ってそれは民主主義に対する冒涜、挑戦ではないんでしょうかねえｗｗｗ",oppose,political_ideology,政治資金規正法をめぐる議論として高市氏の発言批判に反応
"SNSの野菜は洗脳済みだから
何言っても何しても高市が正義、反高市は悪党、中国の手先ということになってます",oppose,political_ideology,高市擁護を正当化している政治的レッテル
">>610
まあ、SNSはとっくに死んだからな。
というか、なにしろマスクのツイッター買収で完全に死んだよｗ
まさか2ちゃんが最後まで残るネット上の言論の場ということになるとは、
さすがのおしゃかさまでも分かるめぇよｗｗｗ",neutral,other_reason,SNSやインターネットの現状を批評するもので、高市氏には無関係
馬鹿どもが騒ぎすぎでしょw 何か都合悪いの？,oppose,other_reason,高市氏への否定的呼びかけ
>>21 全く同じこと思ったけど こんなのフォローできないからしょうがないよ,oppose,leadership,指導力不足と判断
失言しかしねえなこのババア,oppose,leadership,高市氏を「ババア」と中傷し、指導力否定
"実際はインターンスタッフ
当時職場で一緒だった人がモーニングショーにリモート出演してた
・女性の活躍の仕方に興味があって勉強してた
・英語はピーナッツバターの様なカジュアルな単語から取り組んでる感じ
という話だった
ジャーナリストの小西は「高市さんの英語の発音は何を言ってるか伝わらない」と言ってたけど、APECでスピーチしたのは「日本語でいきましょう」と言われたのを独断で押し切ってやってしまったらしい",neutral,other_reason,個人の英語学習やスピーチ経験を述べたもの
んと、その「インターンスタッフ」っていうのは、つまり米国ではなくて日本で働いてるわけなのか？はっきりいって俺が見ても、高市早苗の英語力ってのは、英検3級にも届かないと思うのだが？ｗそれで米国で仮にも「仕事」ができるってのはちょっと考えにくいのだけどｗ,oppose,leadership,英語力不足による指導力批判
立憲が次の選挙でどうなるか楽しみだなw,neutral,neutral,党首討論に関する見解提供なし
野田、安住、岡田は小沢に余生の過ごし方勉強させてもらえ 蓮舫とか小西が必死に党そのものを潰そうと頑張ってるから ウケるわ,oppose,political_ideology,野田らに対する嘲笑を含み、対立陣営への否定的言及
"話題を転換するなよw
ちゃんと向き合え",oppose,leadership,高市氏の転換発言を不快に感じ、対応姿勢を批判
"裏金、壷ばっかの自民党
既存政党全部1回ぶっ壊さないと駄目だろ
利権が絡みすぎ",oppose,political_ideology,自民党への不信感と既存政党転覆を訴え批判
"ほんとおかしいよなあｗ
そもそも質問はあらかじめ提出されていて、想定される受け答えの答弁書が用意されてるのに、
なんでそれを無視してまで、「話題を転換」しなきゃいけないのかｗ
もう高市早苗は癲癇じゃないのか？ｗ",oppose,leadership,癡癲癇の表現でリーダー失格を批判
このオバハン頭悪いだろ、学歴疑うレベル,oppose,leadership,政権関係者の頭脳を直接否定
募ってはいるが募集はしていない,neutral,other_reason,表明が曖昧で立場判定不可能
"松下政経塾がお金を出して行った見習い実習になる
英語は本当に通じてないと思う
トランプとの初対面でもノーカット映像見ると、暗記した挨拶をまくしたて、トランプが途中で喧嘩の様に指差ししながら口を挟み、でもそのまま2人とも喋り続けるという見てる方が脂汗が出る場面もあった",oppose,leadership,英語の不通・暗記アプローチが指導力を否定
立憲は次の衆院選も裏金ガーとか続けてな？それでどれだけ議席減らすか試してみよう,oppose,political_ideology,"立憲民主党の政策批判
"
同じ口グセを持つ知り合いがいるけど定期的にトラブルをおこすので近づきたくない,neutral,other_reason,批判・擁護ではなく、個人的過ごし方を述べている
"官僚のカンペを無視して勝手に喋る
何も変わってねえな",oppose,leadership,指示無視や行動の非成熟が指摘
">>626
わかる気がする",neutral,,「わかる気がする」という曖昧な表現で立場表明なし
">>624
ああ、あれ松下政経塾なのか……ｗ
しかし、松下政経塾もただの一人もまともな政治家出さなかったなｗｗｗ
松下幸之助が草場の陰で感涙に咽んでそうだなｗｗｗ

なんかよくわかった、ありがとう。
つか、あと安倍晋三の発音も、あれも通じそうになかったけどねえ……ｗ
まあ、それでもまだ拙いなりに英語でしゃべっているのは分かったから、まだ、な……ｗ",neutral,other_reason,松下塾や安倍氏への言及で立場表明はない
"ちょっとイラついただけですぐ失言するのは治らんだろう
一国の首相に向いてるとは思えんなあ",oppose,leadership,失言と首相適性への否定
須田のオジキも随分ときな臭くなったな,neutral,other_reason,「須田のオジキ」とは記事で触れられておらず、文脈に合わないため
そんなことより一献くれまいか？,oppose,other_reason,高市氏発言への軽薄な皮肉として判断
な？まんってゴミだろ？,oppose,other_reason,人格否定を伴う擁護できない表現
バカ市,oppose,leadership,高市氏への人柄的否定
"高市は昔から口が災いを起こすタイプ。というポストに、学校で先輩後輩の仲だった人が「とうとう高市さんの性格が周知された」とリプ
党内で嫌われてたのは付き合いが悪いからではなかったのかもしれない",oppose,leadership,言動による人間関係悪化を指摘
これもまったく言う必要なかった言葉だよね,oppose,political_ideology,特定の政治的行動に対する否定的評価
彼らはロボットや脳死したゾンビみたいなものだと思うしかない まともに議論出来なくて疲れるだけ,oppose,leadership,野田代表を批判し、政治家としての能力を否定
"っていうか、まあ高市早苗は、英語はもういいからさ……
まず日本語をちゃんと勉強してほしいｗ
つか国語ねｗ
ってか、教育勅語大好きんでしょ？ｗ
だったら、とりあえず論語をちゃんと勉強しよう？ｗ
それで漢籍も国語も勉強できるよ、一石二鳥だｗ",oppose,leadership,日本語能力や知識不足を指摘し、指導力に疑義
">>632
ふ...心して呑め
百万石の酒ぞ",neutral,neutral,武士の酒くらべという武骨な表現。政治議論と無関
