comment,stance,reason,explanation
">>1
米国(ユダヤ)は既に未来と通信しています。 
未来の知見と未来技術でこの世界を裏で完全に統制しています。 
この世界の出来事は全て茶番です。日本の政治も裏で統制されています。 

ユダヤは未来を知った上で、現在(過去)において色々と動いてきます。 
米国の要人がお世辞を言うのは、高市が長く続くのを知っているからです。 
高市が長く続くのは間違いない。 

ユダヤが後ろ盾にいる以上は選挙に勝つでしょう。 

ユダヤの末端工作員はあらゆる分野にゴキブリのようにいます。 
ある時は統一の仮面を被ったり、ある時は創価の仮面を被ったりして、 
政治情勢に応じて支援する人物を変えます。特定の組織に固執することはない。 

さらに、傘下のメディア言論人を操って印象操作をするだけでなく、 
電磁波兵器で大衆の感情を操ったりします。 
高市の時に中国との間で紛争が起こり、憲法が改正されるかもしれません",support,political_ideology,ユダヤの陰謀支配説に基づく支持
"日本が外交官を追放した場合には更に問題が拡大する余地は出て来ます 
これは中国のリスクコントロールの側面もありますが 
このリスクコントロールは問題を縮小させる方向とはなっています",neutral,other_reason,日中対立の展開についての将来的な見通し述べ、高市氏に焦点を当てていない
もう沖縄の米軍ほとんどフィリピンに退避済みでしょ,neutral,neutral,事実確認の質問で立場表明なし
"米国(ユダヤ)は既に未来と通信しています。   
未来の知見と未来技術でこの世界を裏で完全に統制しています。   
この世界の出来事は全て茶番です。   

この世界の政治には、ユダヤによる配役とユダヤの演出があるだけです。   
昨今のユダヤの演出を窺うと高市の時に中国との間で紛争を起こそうとしている可能性がある。   

・メディア言論人などによる高市に対するヤジへの異様な批判   
→批判を封じて独裁的な権力を事実上付与し、戦争を遂行させる。   

・米兵の前での情緒的な演説と軽いノリ   
→法に合致していなくても情緒とノリで米軍の支援を押し通させる。   

・スパイ防止法   
→日中要人の意見交換を妨げて、戦争の回避や和平を困難にさせる。   

・国旗損壊罪
→国民よりも国旗(国)を上に置いて、国の命令に逆らえない風潮を起こして戦争遂行。   

・議員定数削減   
→これまでの経緯を無視して比例定数だけを削減し(左派を潰し)、国会議員の数を減らし、政権を独裁的にして戦争遂行。",oppose,political_ideology,ユダヤを原因に掲げ、国家権力の拡大・戦争遂行を陰謀と表現
"読売テレビの解説員の話では 
トランプさんが高市さんを気遣って 
電話したと解説してる",support,leadership,トランプ氏が高市氏を気遣ったと解釈
このまま放置したら、トランプが勝手に「数日以内に日中関係はいい方に向かうだろう」とか言い出して、日本に圧力かけてきそう,oppose,politics_ideology,日本を無視した行動を批判
,,,
,,,
"分割統治
ぶんかつとうち
divide and rule

支配者が被支配者を分割、すなわち被支配者の団結を妨げて分裂させ、それをもって統治を容易にさせようと
うこと。「分割して統治せよ」ということばは、元来は古代ローマ帝国のその支配地域における統治術をさ
るものである。そこでは被支配部族・民族が互いに離反・対立するように策し、ローマの支配に対する彼ら
の敵愾心(てきがいしん)を分散させ、被支配者の連帯よりもローマへの忠誠心を生み出すようにした。そうす
ることでローマ帝国の統治を容易にした。こうした統治術は植民地時代に欧州列強によって用いられ、イギリ
スやフランスなどは分割統治を原則として植民地住民を統治した。たとえば、スーダンにおける統治でイギリ
スは北部住民（アラブ系）と南部住民（ネグロイド系）の対立を利用し、南部住民を軍隊に用いて北部住民を
抑え込むなどした。",neutral,other_reason,単なる概念の説明である。
"高市「うちのバカヒ新聞が誤報をして申し訳ありません」   
これで解決じゃね？",support,leadership,高市氏の認識と発言を支持者として評価
"G20では
高市さんは目的を達してるとも

インドにはレアアースを宜しくと伝え

戦闘機の開発は英伊日で開発しようねと
トランプ大慌て",support,diplomacy_ability,高い外交成果を評価
"米国(ユダヤ)は既に未来と通信しています。あらゆる未来技術を備えています。   
それでこの世界を裏で完全に統制しています。この世界の出来事は全て茶番です。   

自民党や維新、国民民主党、日本保守党、参政党などの右派が強いのは、   
米国の工作組織が裏でメディア言論人を操って巧妙に世論を誘導したり、   
資金面や人員面で支援したりしているからです。   
未来技術も所々で用いて世論を誘導しています。   

日本の政治を右派で固めて中露などと戦争させるためです。   

だから、自民党の政治資金規正法違反事件もトカゲのしっぽ切りで終る。   
共産党など比較的真面な議員の多い政党はメディア言論人に叩かれる。   
連合も共産党を排除しようとする。   
玉木の不倫も大した問題にならない。   
メディア言論人などが高市を異様に持ち上げる。",oppose,political_ideology,高市への持ち上げを外国工作と批判
"トランプ「おい、キンペ、サナエをこれ以上いじめたら、わかってるよな？」
キンペ「は？そんな事言える立場か？
レアアース無いとアメリカ終了やろが」
トランプ「ぐぬぬぬ・・・」",neutral,other_reason,シュールな設定で実際の評価を含まない
"トランプの大好きなイタリアの首相とバグを見せつけ 
トランプ大慌て",neutral,other_reason,トランプ氏の行動とイタリア首相への言及で、高市氏評価の意図なし
"立憲や朝日に責任転嫁してた奴らどんだけ洗脳されてるんだ   
おかしいと自分の頭で考えろよ。",oppose,political_ideology,立憲や朝日を目の敵にした右翼的価値観を明示
">>1
これ書いた朝日が謝罪すりゃ終わる話だろ",neutral,other_reason,意見表明なし、報道内容への評価
"トランプ氏、米中電話協議を要請か　日本への「伝達役」を担った訳は [蚤の市★]？   
第二次日中戦争の回避ｗ   
2025年　高市早苗　台湾有事で存立危機事態適用宣言、防衛費GDP比２％の前倒し   
2026年　安保3文章改定（非核3原則の見直し：核共有？核兵器開発？）、憲法改憲（自衛隊の国軍化）、自衛隊法改定（徴兵制の復活）、スパイ防止法成立（治安維持法の復活）   
2027年　中華人民共和国　台灣侵攻？第二次日中戦争？日本国２度目の敗戦ｗ
【2025年】世界の軍事力ランキング（GFP）   
GFP（グローバル・ファイヤーパワー）による軍事力ランキングでは、各国の軍事力はPowerIndex（パワーインデックス）というスコアで表され、   
PowerIndexの数が小さいほど高い軍事力を有していることになります。   
※理論上は0.0000が最高   
順位   
3位　中国　0.0788
8位　日本　0.1839
中国：日本　→　23：1
兵員   
中国人民解放軍　300万人　自衛隊　31万人　→　10　：　１",oppose,political_ideology,右傾化・軍事的展開への思想的賛同を示唆
第二次世界大戦では、日独伊三国同盟でしたが   今は、日英伊＋米韓ですわ,neutral,other_reason,歴史的事実と現状の対比に過ぎず、候補者への評価は含まれない
">116 
維新だけでなく、国民民主玉木も立憲民主党が悪い言い出したな 
高市ダメやんって流れになってきたのに、今更余計な事言うのが玉木だわ",oppose,leadership,玉木氏の発言を不適切と批判
いや中国が勝手に勘違いして勝手にファビョってるだけだろ,oppose,political_ideology,高市氏の発言を中国の誤解と否定
,,,
答弁直後に高市周辺が動揺してた時点で高市の失言だよw,oppose,leadership,周辺の反応から判断してリーダーシップの欠如
"答弁の内容をよく精査もせずに条件反射的にキレ散らかして   
迷惑してるのはこっちだよ",oppose,diplomacy_ability,対中外交のやり方に不満を表明
"円安バカ市が追い詰められていて草 
謝ったら死ぬ病気なんでしょ？ 
どうすんの？w",oppose,leadership,ソフトな表現だが高市氏統率力に否定的
,,,
">>1
トランプ電話では台湾の話はなかったと発表されてるけど 
なにまたへんな報道してるのさ",neutral,other_reason,背景報道に対して不満或いは矛盾を指摘する内容。
木原も進二郎も高市言い過ぎた、言ってるやん,oppose,criticism_validity,高市氏の発言が批判されていると表明
,,,
戦闘機開発の件じゃね F35をトップセールスしてる 邪魔,oppose,political_ideology,F35販売への批判は政策米国依存を含む
>>127 どこでそんな発表が,neutral,other_reason,事実確認を求める文で、立場は表明していない
,,,
"習近平主席がトランプ大統領に日本を抑えてくれと頼んだのか 
まぁ、日本に色々圧力掛けようとしてるけれど効果無い物ばかりだしトランプ政権の間は日米とあまり揉めたくないのかもね 
従来通りに過去の政府見解を踏襲すると言っている事を中国も分かっていて手を振り上げたけれど、日本が退かないから打つ手が無くなって来たのだろう 
そもそも中国側も仕掛ける時期が悪すぎる、ハネムーン期間に殴りかかって効果が十全に出る訳ない、今回の絵を描いた人物は能力が足りてない",neutral,neutral,高市氏への支持・批判意見なし
中国の刑務所から工作してる五毛すらもらえないお客さんが多くて困る 1日何レスがノルマなんだろうか,neutral,other_reason,高市氏へ向けられた支持や批判が曖昧
"あーあ、トランプに怒られてやんの 
当然か 
忠実な犬は飼いたくてもキャンキャン吠える犬は要らないもんな 
ネトウヨと高市は責任取れよ 
代わりに戦争に行くのはお前らだからな",oppose,leadership,高市を「犬」と蔑視し、責任逃れを非難
"日本のメディアは中国の発表を基に記事にしてたからね   
米国発表の記事は無いし   
台湾の件も言い分は分かったとしか   
回答してないのでは？",oppose,criticism_validity,蒋介石支持を批判している
>>117 答え合わせかな,neutral,other_reason,文面から立場表明が無く、文脈も曖昧。承認や批判を伝える提示と見做せない。
トランプが動いてくれて良かったな、日本だけじゃどうにもならなかったぞ。,support,diplomacy_ability,トランプの外交努力を評価
そんなこと言ったらトランプから高市への電話の内容も高市談でしかないだろ,oppose,other_reason,高市の発言を否定し、影響力の根拠を成り立たせなことを批判する
"トランプが仲裁してて草 
やっぱ高市は極右やね",oppose,political_ideology,「極右」という政治的レベリングが高市氏勢を直接批判
嘘を吐き続けて100年、朝日新聞です。,oppose,other_reason,高市氏無関係の新聞批判で立場表明
"でも電話の後、絶対に撤回しないと閣議決定したよ   
もう意地になってるんじゃない？",oppose,leadership,意地を張っていると批判
"でも世論調査見ると高市発言は間違っていないと思っている人が多いし、中国の経済制裁も歓迎している意見多から高市自身は何も変えるつもりないでしょ   
中国の経済制裁はますますエスカレートして長期化すると思うよ",support,political_ideology,世論支持と経済制裁歓迎という主張
でもトランプはこの間に台湾に対してミサイルを販売して納品してるんだよな,neutral,neutral,トランプの対台行動に関する述べで、高市氏の見解に賛成・反対表明なし。
>>116 ネトウヨみたいなバカに合わせた政治やってんだから 無理やろ,oppose,political_ideology,高市氏の政策を『ネトウヨ的なバカ』と中傷
,,,
ルーピーを野放ししているからに決まっている　ビジネスの邪魔になる,oppose,leadership,指導力不足を批判
,,,
>>142 中国もうトランプが出てきたから騒がないでしょ,neutral,neutral,中国の行動に関して主張が明確でない
,,,
"トランプ氏、米中電話協議を要請か　日本への「伝達役」を担った訳は [蚤の市★]？   

高市不況の到来を警告ｗ   

・日本銀行に圧力をかけ、政策金利の利上げの見送りの連投ｗ   
・「責任ある積極財政」で赤字国債の乱発で国債の信用は低下し、政策金利は低金利だが長期金利は上昇ｗ   
・コストプッシュ型インフレの状態化ｗ   
・結果的に企業業績悪化し、「株安・債権安・円安」のトリプル安に陥るｗ   
・台湾有事での「存立危機事態発言」でｗ日本製品の不買運動、中国製品（レアアース含む）の日本への輸出禁止により経済の崩壊ｗ",oppose,leadership,経済崩壊を指摘する批判的評価
"高市はかつての首脳会談前の電話会談も楽しい時間を持てた。とか明るい話を言ってて実際は「総裁選で私なら80兆の見直し交渉すると言ってたらしいけど、やるなよ」だった   
今回は「友人」と「いつでも電話してくれたらいい。」   
これは信者は評価してるけど、キンペーとの電話の後だし何らかの指令があっての台詞だと思った方がしっくりくる",oppose,political_ideology,トランプとの親密演出が命令によるものと批判
"トランプは九つ目の戦争解決に動いたんだな 
この仲裁がなかったら、どんどんヒートアップしてそうだもんな 
世界をよく見てるんかな",neutral,,トランプの行動を評価する内容で、高市早苗氏擁護/批判は不明
,,,
80兆円のお礼はこれでチャラ,oppose,leadership,占領明けの賄賂と批判
幼稚で自分のことを「私」とも呼べない顔の硬直したドスのきいた田舎臭いブスではなくイメージ通りですね和久井健(笑),neutral,other_reason,内容が特定人物の外見評価で、高市氏への立場表明とは無関係
,,,
厚かましすぎる能無しの田舎臭いブス,oppose,leadership,人間に対する侮辱的表現で指導力否定
,,,
"美 よ 美 

美 伊 奈 
美 南 

ちなみに名前の由来は１９のときに白人からB e a u t i f u l- F l o w e rって言われたそれかもね",neutral,other_reason,固有名詞・意味不明な呼びかけで論点不在
中国様が怒ってる報道が減ったなw    日本国民が中国に反発するばかりで高市支持を増やしただけだったからなw    オールドメディアの支持率下げてやる！作戦失敗w,support,political_ideology,右翼的な中国批判と高市擁護を意図
,,,
高市にはトランプから電話したけど米中の方はキンペーがトランプにお願いしたんだろが,neutral,other_reason,事件の経緯や言及の出所についての文脈提示だけで、立場表明がない
放火魔の朝日新聞じゃねえかこれ,oppose,political_ideology,反対の立場を明確にし、特定報道機関を批判
"在韓米軍司令官が「韓国は中国を攻撃する際の発進基地」と明言した。 
米中関係は極めて強固と言っているトランプ政権の実際の動きは結局台湾関係法に沿って変わってないんだよね 
これを撤回すれば海洋国家であるアメリカの覇権が潰れるから撤回出来ないってのも有る 
中国が何を言おうとアメリカが台湾防衛で海軍出たら日本は支援を要求されるし、米海軍が台湾防衛に出ないなら日本は出れないってだけの話",neutral,neutral,記事と無関係な観測のコメント
"テレビもネットも中国は日本に経済制裁する余裕がない。という見立てだけど、個人的にチャイナリスクで撤退する日本企業が増える事による値上げが起こると思う   
中国で生産してる企業、製品の中に中国製を使ってる企業、中国での販売で儲ける事で価格を抑えられてた企業もあるし",neutral,other_reason,高市氏支持/反対の表明無し。経済影響観測の話
"和久井健

あなたはきちんと現実を踏まえてまともな意見を導き出し
恩人を守るどころか公然で毎日のようにセクハラと侮辱の言葉を吐き続け
若い女の頭がてっぺんから刈られるまで追い詰めた",oppose,political_ideology,セクハラや人権侵害を正当化する論理を支持と判断
"若い女の頭が剥げている   
和久井健   
お前みたいに努力などしてこなかった   
ただ先天的に何の能も無いブス   
金目当ての社会の屑に何を譲るために？",neutral,other_reason,記事と無関係な内容
"お前言いたいことがあれば堂々と出てきて言ってみろよ 
お前じゃない他の社員が正しい情報言ってくれると思うから",oppose,leadership,高市氏が堂々としないと述べ、指導力に否定的
,,,
"守るものなど何１つ無いお前が招いた顛末   
１０年後も自分は間違ってなかったと言い聞かせることが出来ればいいなお前のようなチンピラ和久井健(笑)",oppose,leadership,高市氏を「チンピラ」と侮辱し、指導力を否定した
>>166 中国依存よりもwトリプル安がヤバいw 株も中国人の投資家が売りに走るとw 一気に株安になるw,neutral,other_reason,経済不安への言及で領土問題には言及していない
,,,
"私と ア メ リ カ 人 (編 集 者）   
２ 人 の 仕 事   
使い物にならなければ 白 人 と 交 代 し ろ という要請はあったはず   
読みやすく流 れ の 良 い 文 章 が 書けるのは私の 天 性 の 才 能 なんですよ和久井健(笑)   

情報の整頓が上手ってことだから舐めてかかれたものではない。   

私以外にそんなスペックが似合う人などいないにきまってるでしょう。",neutral,other_reason,本人の才能や仕事についての主張であり、高市氏に対する支持・批判ではなく、記事主題とは無関係なスパム的に似た自己主張である。
"２か月で２６冊の洋書読んで少なくともIQ１４５はあると言われた（文章力もあったから言われてる） 

あなたはこれを見て知っていたよな和久井健。 

IQうんぬんのコメントは見逃していたのかもしれないが、これだけのことやってりゃ称賛されて当たり前。 

無理に評価してもらいたいとは思っていないが キャラ化するならまともにしろとこのアホ和久井健。",support,leadership,ご自身の行動を正当化し、称賛を受けて当然と考える姿勢。
朝日ってさぁ,neutral,other_reason,差別化表現で批判や擁護の意図不明
,,,
言えるなら言ってみろよブス(笑)   負けてるくせに,oppose,leadership,相手を「ブス」と侮辱し、敗北を指摘
"逃げるなよお前 
最後まで言ってみろよ 
恥を知っているなら(笑)",oppose,leader_ship,批判的内容で、リーダーとしての資質を問う
日米安保への不満発言も繰り返すトランプがなぜ媚びる事しか脳のない無知無能無責任女の尻拭いをしてくれると思えるのか,oppose,leadership,高市氏を無知無能と評し、指導力否定
"左翼てトランプ嫌いだったくせに   
キンペーと近付いたらトランプまで応援しだすし   
高市叩く為なら信念関係なくなんでも利用してヤバすぎるわ",oppose,political_ideology,トランプ利用の虚偽を批判
">中国との関係改善をめざすトランプ氏が来年4月に予定する訪中まで「迷惑をかけないでほしい」という意味だと分析した。   
トランプからの話は、最近の米中関係についてだからな   
トランプは習近平を国賓として招こうとしたりと、中国との関係改善しようとしてるのは明らか   
そして、最近の米中関係なんて、日本に直接関係ないのに、わざわざ説明した意図を考えれば、この分析に近いことを言われたんだろう",neutral,neutral,文脈から立場表明がない
"早くネトウヨが戦争に行くのが見たい 
ネトウヨは堅実でも一騎当千してくれるから安心して任せられるな！ 
アメリカも後ろで見守っててくれるから台湾人のために滅私奉公してきなさい",support,political_ideology,戦争を好む右翼的価値観を表明
トランプは習に「何か問題があるのか？」って聞いたんだろ、「いえ、ありません…」だから台湾有事に関しては話をしていない,support,diplomacy_ability,トランプが日中問題を調整したと評価
"トランプ大統領、中国総領事の高市総理批判投稿巡り「同盟国も友人とは言えない」「私は中国と良好な関係」… ★18
2025.11.11　/newsplus/1762951034
　↑
状況証拠的に日本版CIAﾁャｲﾅﾁｮｰｾﾝｲﾝﾃレﾘｼﾞｪﾝｽｴｰｼﾞｪﾝﾄって自民（と朝鮮プロレス野党）の清和会だから、親中反日反トランプDS日本支部もアベ鳩山小泉河野菅じじ石破ｹｹ中橋下百田青山高市ラインだよな",oppose,political_ideology,高市を親中派と非難し、政策姿勢を攻撃している
仮に中国が尖閣諸島や沖縄に武力持って実効支配しようとすることに中国が反発するなら俺もネトウヨに同調して高市を応援してたよ ただ台湾問題ってあくまで他国同士のことだししかも日本は台湾を国として認めてない以上は「内政干渉」だという中国の言い分に正当性を持たせてしまうんだよ それでも台湾を見捨てるわけにもいかないし台湾侵攻を実行されたら日本も困るのは確かだから曖昧戦略で水面下で牽制するしか日本にできることはない いっそ台湾を国家承認して独立の後押しをしろと高市応援団は言いたいんだろうけど今の日本の国力でそこまでやるのも無謀すぎる,support,political_ideology,高市擁護の立場が明示され、その背景に主張を述べている
