comment,stance,reason,explanation
戦争は確定事項 ゼレンスキーやネタニヤフのように 高い支持率を維持する為に戦争をし続ける必要がある 中国が先制攻撃を仕掛けてくるまでの我慢だ,neutral,other_reason,高市氏批判ではなく、戦争や他国政権を論じている
">>764
あの時は官僚はどこまで利権を潰されるか戦々恐々だったわけで、組織ぐるみでやってた可能性はある",neutral,neutral,高市氏の分析や評価なし
"終末思想大好きQアノンカルトウヨは、
統一教会、サンクチュアリ教会、キリスト教福音派、幸福の科学、法輪功 等
四年前日本でトランプ再選デモをやって素性がバレ済ww
台湾と日本を1つの韓国にする
https://i.imgur.com/IIJe79n.jpg",oppose,political_ideology,極右思想・カルト系団体を論じ、高市氏の価値観と対立する表現
"急いで話題をそらしたんですねｗ
政治とカネの話題は困るものな
汚れ切った旧来の自民党じゃん",oppose,leadership,高市氏の話題転換を非難
無能の馬鹿が総理だと介護するのも大変だよなあの石破でさえ不用意な発言はしなかったのに高市は感情だけで政治をやってるからな,oppose,leadership,高市氏の政治手腕を評価せず、感情的な判断を批判した
>>765 これ、アメリカならF◯◯k！言われる奴やな。ネトウヨいい加減にしろ,oppose,political_ideology,ネトウヨと皮肉を込めて批判
韓国で“反中国”デモ拡大…「高市首相がいる日本がうらやましい」の声も,neutral,other_reason,韓国市民の発言を引用し、立場表明がない
">>21
なんかどうしようもない人なんだな高市",oppose,leadership,高市氏の能力や資質に対する否定的評価
WSJさん木原からの抗議を受けてトランプの発言をより正確に「トーンを下げろ」から「黙れ」に訂正,neutral,other_reason,実名負荷の差異を比較した箇所だけで立場表明なし
これもネトウヨが良く使う論点反らしだよなw そんな事より他にやることあるだろ！！！ 正にネトウヨ内閣 正にバカ市さなえwww,oppose,political_ideology,ネトウヨという差別的表現で抑制
吉野家のコピペ思い出す,neutral,other_reason,既存コメントの引用であり、立場表明なし
壺市「そんな事よりも〜♪中国に謝意もしくは発言撤回はやらないの？w」,oppose,political_ideology,対中姿勢に関する批判を含む内容
"補正組んでも物価下がらない
むしろ物価は上がる
組まないほうがマシだった

失言して中国とは交流途絶
トランプアメリカには捨てられる

そして政治とカネの話題には答えられない
急いで話を逸らすしかない
なぜならカネまみれだから

さらに長期金利上昇で円が暴落だから
新規の国債発行ができない
増税もできないし緊縮もしないだろうから
たぶん予算組めない

良いところが一つもない
これが高市内閣",oppose,leadership,高市内閣全体に経済・外交・政治に至る問題を列挙
">>769
まん様に指導者をやらせると国が滅ぶよな。",oppose,leadership,指導者としての資質を疑問視
">>773
安倍政権の時だって安倍が靖国参拝したら中国を刺激するなとアメリカは怒ったしな",oppose,diplomacy_ability,アメリカの反応により外交的誤算を指摘
ウソつき壺市〜♪無能な働き者のサモシィ壺市〜♪w,oppose,leadership,高市氏を無能・嘘つきと批判
">>779
しかも中国を国賓で呼ぼうとしてるアメリカの邪魔をする目的で喧嘩を売ってるらしいな",oppose,diplomacy_ability,外交的判断に問題ありと批判
"中国は台湾を武力侵略して大勢の台湾人を殺して占領するって宣言してるんだよ
高市批判してる達はそれでいいの？
普段人権ガーって喚いてるのは何なの？
殺人ほど重い人権侵害は無いだろ
中国が台湾を武力侵略しません
平和的な統合を目指しますって宣言すればいいだけの話やん",oppose,political_ideology,高市氏の対中政策姿勢への批判が主
壺市が、中国人観光客と中国人留学生はサモシィから受け入れゼロを目指す〜♪とか言ってくれたら最高なんだがwww,support,political_ideology,高市氏を右派的立場で支持する内容
言ってないよ馬鹿なの,oppose,political_ideology,高市氏の発言を真っ当なものとは否定
">>782
台湾の国民党(外省人)は中国と仲良しだよ。ら",neutral,other_reason,高市氏擁護・批判せず両論併記なし
"米中会談でお互いを国賓として招待するのを決定
その後にトランプから日本へ連絡がある
どう考えてもトランプは米中関係の発展維持を目的としてるので
米中関係を壊しかねない高市に釘を刺す為に電話したのは明らか
そこら辺はちょっと頭が回る人なら誰でも想像がつく",oppose,leadership,高市氏の判断が危険と明確に否定
しかし揚げ足好きだよな、そんで揚げ足取る奴はいつも揚げ足とられて泣いている,oppose,criticism_validity,高市氏が批判されたとみなし、批評対象を責める表現
">>782
日本と台湾は別の国だから
台湾が攻められてもそれは日本が攻められたわけではない
だから存立危機とか言って
軍事行動を起こすとかありえないわけ

というかさ
今現在、国後択捉はロシアに
竹島は韓国に
それぞれ占領されているの
今現在が、存立危機なんだよ
でも軍事力発動していない
なのに何で台湾が攻められた時には軍事力発動するのさ？
おかしいわ",oppose,political_ideology,台湾関連の安保観を批判
田中角栄首相が訪中、中華人民共和国首脳の毛沢東・周恩来などと会談し、日中国交正常化に合意し、１９７２年９月２９日に日中共同声明を発表した。日本側は過去の戦争責任を痛感、反省することを表明し、日中平和友好条約の締結をめざすこととなった。これによって日本は中華人民共和国を中国唯一の政権と認めたので、台湾とは断交することとなり、１９５２年に締結されていた日華平和条約は無効となった。,neutral,other_reason,歴史的事実の記述のみ
"この女はもう駄目だな
1ヶ月で何回やらかしてんだか
学習しろよ",oppose,leadership,個々の失敗を批判し、指導力に疑問を呈
わざわざトランプやアメリカの邪魔をして顔に泥を塗るためにやってるらしいですよ,oppose,diplomacy_ability,アメリカ対応を批判
「そんなこと」で片付く軽い内容ならさっさと公表すればいいだけでは？なにもやましい事なんて無いんでしょ,oppose,leadership,高市氏の発言を軽く扱ったと批判
>>757 岸田と争った総裁選の後、安部チョンが高市を怒っていたもんな。　応援してくれた人に挨拶もしないのかって 安部チョンが生きていたら礼儀知らずの高市は自民党から追放されていたかもな,oppose,leadership,高市氏の行為を「礼儀知らず」と批判
予算委員会だから予算委員会について話しよって 立憲にいってんだろ ほんと立憲ってろくでもねぇーな トラップ仕掛ける事に一生懸命で中身なし,oppose,political_ideology,立憲民主党の戦略を否定し、中身のない野党と批判
>>685 正論だわ,support,other_reason,高市の発言を正論と肯定する内容
知らんけど,neutral,other_reason,主張なく無関係な断定表現
正直これまで無能だと思ってた元総理や野党議員がまともに見えてくるレベルで高市ヤバいと思うんだけど 議員にもなっちゃいけないレベルだろこれ 尻拭いしてる周りの政治家や官僚ももうお手上げでしょ,oppose,leadership,高市氏の能力や資質を否定
>>684 森羅万象司る総理として恥ずかしい行為だよ,oppose,leadership,総理としての在り方を批判
「政治改革への姿勢に疑問」公明・斉藤氏、首相の「そんなことより」発言を批判,oppose,leadership,政治改革姿勢への疑問を表明し、指導力批判
中国が国賓に呼ばれるなんて許せない！米中関係をぶち壊すわよ！　こういう事らしいな,oppose,diplomacy_ability,中国を国賓に呼ぶ外交対応を批判
">773
せっかく柔らかく言い換えてメンツを立ててくれたのにな
デマ記事呼ばわりされたらWSJも腹立てるだろ
何で他人の善意に悪意で答えちゃうかね
発想の根本が「テイカー」だからかな",support,leadership,相手への配慮や善意を肯定
">>786
トラ様「へい、壺市。もっと中国を挑発しろ
型落ち武器を高値で買え」

壺市「ピョンピョン〜♪」

クマぷー「壺市〜〜」",oppose,other_reason,中国挑発発言や輩出批判を風刺
"与党も野党も互いの裏金の追及に時間を割く国
国民無視",oppose,criticism_validity,政治が国家政策より裏金問題に時間を割くことへの批判
"まあ立憲の長々持論感想文の後最終的な問いは
実は自分達の要求は入れず逃げ道残した相手に感想求めるだけの本当に時間の無駄でしかない討論の仕方されてちゃ
もっと他の党の議員の様な実のあること言えないの？と皮肉言いたくもなるわな
長年批判政治し過ぎてたせいで責任逃れ答弁癖が抜けきれないらしい",oppose,criticism_validity,立憲民主党の議論スタイルを批判し、批判の正当性を指摘
大本営発表だからなあw,oppose,political_ideology,戦時中の大本営発表を皮肉る表現で批判
"普通に国政どう変えてくんだろうって事に関心もって中継みてもいつも裏金の追及してたら逆に立憲の心象悪くなる事くらいわかんないのかな
ほんとお馬鹿な政党です",oppose,leadership,立憲民主党の対応を「お馬鹿」と評し、指導力を批判
しかし失態の度に支持率は上がる,support,political_ideology,支持者が増加する点を肯定的に捉えている
">>782 分離独立を宣言したら独立戦争が起こる
当たり前のことだろ
アメリカが独立宣言したとき、イギリスは黙って見てたのか？",neutral,neutral,記事と無関係な.Abstractな発言}
国民人気が高市無双状態だから反高市勢力は賢く立ち回らないと全部自分の失点になるで,support,political_ideology,高市氏の人気が中心と捉え、擁護の立場に立つ
"補正予算→かえって物価上がる、やらないほうがマシ
日中関係→ズタボロ
日米関係→米国から怒られる
米中関係→米国が中国を国賓として招待、一層強固になる

高市は何をしてもダメ",oppose,leadership,高市政権全体の判断能力を否定
"就任1ヶ月で中国やアメリカなど全方位敵だらけ
唯一の拠り所は胡散臭い支持率だけ
本当に誰が支持してんだろうね？",oppose,leadership,指導力と信認を疑問視
なんとかズムは民主主義を通ってやってきますか？(´・ω・｀),neutral,other_reason,政治人物への直接批判ではない
補正予算で円安 株安 債権安 物価高,oppose,other_reason,経済悪化を批判
スパイ防止法を成立させるには党内を分裂させられないだろ,neutral,other_reason,記事内容との関連が不明で立場表明なし
"何故か高市を批判すると中国人扱い
高市がやらかして困ってるの日本なのに",oppose,other_reason,高市氏の発言への批判を正当化。対立する見解を非難
>>768 本当高市はネトウヨみたいだよ,oppose,political_ideology,政治的レーベリングにより批判
いやフォローになってないんだがｗ,neutral,other_reason,フォロワー関係のひと言で政治的立場不明
批判すると「女だから批判してる」って思われるからみんな批判できないでいる気がする,oppose,other_reason,高市氏への批判が抑制されている状況を踏まえ、彼女が批判されやすい立場にあると指摘
高市早苗氏「“裏金問題”の調査をすると約束しましたが調査結果を公表するとは約束してません」 [バイト歴50年★],oppose,leadership,約束しない態度が適切でないと評価
"何かさ、石丸 → 参政党 → 高市の流れをみてると、
ハッキリをモノをいう
「敵」と対立することを恐れない
そこに痺れる 憧れるぅ、って言ってるようにしか見えないんだよね
いや、それ自分がビビりだからハッキリ意思表示する人間に憧れてるだけだろ、って言いたくなる
それができる人間なら、そんなとこ飛び越して相手の能力を見てるよ",support,leadership,顕著である対立姿勢を称賛し、リーダーシップとして鑑賞
サナエちゃんが大好きな韓国芸能wwww,neutral,other_reason,内容は無関係で立場不明
高市が就任してよかったことがあるか？　ない,oppose,leadership,高市氏の人物評価を直接否定しており、指導力に疑問を呈
親分同士が手打ちをしている最中に頭空っぽの馬鹿が喧嘩を始めてすぐにヤラれるヤクザ映画でも観ているようだ,oppose,leadership,高市氏を無能な「頭空っぽの馬鹿」と比喩
女安倍,oppose,leadership,高市氏を嘆き「女」で指定し擁護しない
">>824
安倍さんとは全然違う
https://i.imgur.com/W5haDu5.jpeg
劣化小泉劇場でも見てるようだ",oppose,political_ideology,小泉劇場の言及で政治姿勢否定
">>822
ガソリン目茶苦茶下がった",neutral,other_reason,政治改革議論とは無関係
>>807 動画では野田に圧勝したことになってるからな 応援動画にかかればその失態とやらも全て勝利になるそれを見て支持率は上がる 現代の大本営発表,support,political_ideology,敗北を勝利と誤認し支持する流れを肯定
世話を焼かすなって,oppose,political_ideology,高市氏への批判的発言を示唆
サナエちゃんの天のお父様も日本が戦争を仕掛けようとして喜んでおられるだろうな、『もっともっと日本人の印象悪くしなさい！悪い国だから！！』,oppose,other_reason,高市氏に対する否定的発言
">>827
野田は議員定数削減の議論から逃げ回ってる",support,leadership,野田氏を批判し、高市政権の主張を支持
汚れつちまった悲しみに,oppose,leadership,高市氏の発言への否定的感情表明
"(´・ω・`)・・・こりゃ良くないな　そんな事よりも・・・
政治と金で自民が惨敗してる事実は事実だから・・・議員定数で牽制したかったんだろうけど
朝生じゃないからな国会は

未だに政治と金の話は出て来るし・・・台湾問題は不問だが
この発言は看過できない議員定数問題も大事だし、政治と金問題を　そんな事　にしてしまうのどうなんだ？
こういった発言が続くようなら・・・？？？だぞ",oppose,leadership,話題転換で政治とカネ問題を軽視した発言を批判
">>824 安倍はアメリカとも中国とも仲良く付き合っていたけど
高市はアメリカからは怒られ(低金利政策、日中関係悪化)、
中国からは敵視されている
安倍よりずっとひどい",oppose,diplomacy_ability,高市氏の外交成果を安倍氏と比較し劣ると批判
そんなことよりもあんなことやこんな事も,neutral,neutral,抽象的表現で立場がない
テレビ朝日「支持率下げてやる」,neutral,neutral,政党支持率への意図の表明であり、高市氏への直接的な支持・批判ではないため
">>833
韓国もチャイナアウト運動始まってる
アメリカは全く怒ってない
中国は馬鹿だからあまり刺激せずに旨く利用しようと相談しただけ",neutral,none,高市氏批判・擁護を含まず
"(´・ω・`)>>833安倍よりずっとマシ
インフレ問題は壺のミクスの負の遺産・・・相続人の高市は苦労している
アメリカに怒られてる？シナより日本を優先する意味がない
日本は同盟国・・・パヨの妄想、願望を書かれても困る",support,political_ideology,安倍との比較で肯定的で、現政権強調
">>835
勝手に自滅してるね",oppose,leadership,高市氏の行動を「自滅」と否定し、指導力に疑問を呈
高市だとどんどん円安・物価高が進む,oppose,political_ideology,政策思想の結果を批判
"そうだね
だから静かに訳の分からん支持率とは裏腹に最近の選挙では自民系は負け続けている
選挙結果は正直だね",oppose,leadership,選挙で負けるという主張は指導力に疑問を呈している
">>839
ガソリンもう下がった、ガス代、電気代これから下がるよ",neutral,other_reason,エネルギー価格に関する予測で、政治人物批判・擁護に該当
>>769 アホ程爪痕残したがるから、カンペにない台湾有事発言したわけだしな,oppose,leadership,指導力欠如と Warning
"(´・ω・`)>>839パヨの言うところの高金利なら日本経済は破綻する
減税するしかないが、財務省一派の政治屋のためにそれができない
誰がなっても、難しい・・・立憲共産党なぞ更に論外

武器輸出に舵をきってきた点で高市はうんとマシ",support,leadership,武器輸出方針の変更を高く評価
でも人気はあるんだね。そこは安倍ちゃんと一緒？カリスマ性があるのかな？,support,leadership,カリスマ性を肯定し、安倍氏と比較
">>771
デモ参加者がカルト系なのかな？
従軍慰安婦問題では日韓に分かれた統一教会信者が煽ってたのはバレ済だからな",neutral,other_reason,高市首相とは無関係な他事の話題で、文脈が曖昧
しかし本当に高市ってのは答弁も下手くそでこうやって他人からのフォローが常に必要だし外交では恥晒すし何ができるんだ？w 漢字が読めなかった安倍でもこんなことはなかったなw,oppose,leadership,答弁が下手くそで外交に恥をかくと批判
">>841
ガソリン、コレは野党のおかげじゃないの？
電気ガスは前例踏襲

で、円安進行で輸入品は軒並み値上がりで、結局ナニやってんだか？っていう状態じゃないの？",oppose,political_ideology,拙速な政策責めは自民党批判を意識
だって政教分離原則に反してるし、靖国は半分ネトウヨのテーマパーク化してる宗教施設だしな,oppose,political_ideology,保守主義や靖国参拝への同意とされる内容
高市がやったことって長年の連立の解消と中国に喧嘩売ったことと米の値段上げたこととトランプに激怒されたこと 全方位に喧嘩しか売ってないのは笑うわなw 誰が支持してんの？w,oppose,leadership,高市の行動全体を否定し、指導力に疑問を呈
,,,
"もう高市に不満ある奴は国会議員になって進言してくれよ
こんな5chでグチグチくだを巻いてんじゃないよ！",support,leadership,高市を支持し議員の責任を強調
">>777
予算を組む為に維新離党組が三人自民いりだって　N国議員とも組むし数合わせしか考えてないカルトBBA高市",oppose,leadership,政党支持が数合わせと批判
"たかじん委員会メンバー門田とか
どーすんだ
高市支持者だろ",support,political_ideology,高市支持者と断定しており支持を示唆
">>737
前は責めてる人を変に思っていたけど立花逮捕で今は逆だわやっぱり原因が有るのね。",oppose,other_reason,立花氏の逮捕で高市氏を擁護する理由として発言
>>849 Xの自分の太鼓持ちのネトウヨしか見えてない感じよな 他国にマウント取れるように服選んだとか書き込んでて驚いたわw 服じゃなくて言葉選べよw,oppose,political_ideology,ネトウヨへの批判と保守的価値観の否定
このスレにも湧いている高市サポの反日チョンカルト統一協会が支持しています,oppose,political_ideology,高市氏を「反日」と批判
">>837
円安物価高を止めるためには
利上げして国債発行を抑えなければいけないのに
高市は利上げに圧力をかけ国債発行は抑える気がない
アベノミクスをそっくり承継している

そして安倍は低所得者への給付をためらわなかったのに
高市は最低低賃金の引き上げは取りやめ
２万円の給付も取りやめ、4400円？のお米券だけだぞ
安倍よりずっとひどい

また、アメリカはトランプが中国を訪問し
その後中国習近平を国賓として迎えることを表明した
これは中国との友好関係を継続するとの強い表明だ
高市は捨てられたわけ",oppose,political_ideology,アベノミクス継承・給付削減と比較
"それもあるがこれはキッシーから始めた伝統芸みたいなもの
ちょこちょここまめにやってくれて俺は助かったよ
それでも統一の信者からは逆恨みされてネットの悪口凄かったけどなｗ",support,leadership,整治伝統芸を肯定し効果を述べた
">>846
昔からそうだが、短気で失言が多い
今は気持ち悪いくらいの笑顔を作ってやり過ごしてるが
どうせもうすぐボロが出るでしょう
なんか自民党を壊すより、日本を先に壊しそうな予感",oppose,leadership,高市氏の短気さと様子を批判
"そんなことよりもイオンの中国展開が大事
イオンは27日、中国湖南省の省都長沙市に大型ショッピングモールを開業した。湖南を重要エリアに位置付け、成長余地が残る中国内陸部で今後、出店を加速させる。",neutral,neutral,記事内容と無関係な話題を提示
>>782 ネトウヨって思い込み妄想で生きてる精神異常者だよな　中国からしたら台湾は同じ民族だじ、Qカルトが煽るドンパチ台湾有事なんてないんだよ 一番あり得るのは内部からの世論等の工作,neutral,neutral,高市氏と政治改革批判を含まない
もうこの人喋らない方がいいのでは…,oppose,leadership,発言に対する不信感を示し、指導力を否定
(´・ω・`) >>849国民支持率８０％ｗｗｗ パヨチン泣けよｗｗｗｗｗｗ 公明が消えてくれて最高だぞｗ キンペーを泣かした政治家ってトランプ以外に居ないだろｗ,support,political_ideology,高市氏を擁護し、反対勢力を攻撃
">>856
日本人の若者の8割が高市支持の現実だよ",support,political_ideology,高市氏の政治的主張を支持する内容
5chは少数派の井戸端会議とじいちゃんが言ってた,neutral,other_reason,党首討論の軍議に関連づけられず
">>864
日本の若者はバカ者なんだよ
圧倒的なバカ
どのみち長期金利上昇で国債発行できなくなり
予算組めないから
高市は終わる",oppose,leadership,高市の能力を否定し、政権運営で破綻すると予想
"野田のどうでも良い質問なんて「そんなこと」だよ
仮の話をグダグダと続けて、国民にとって何かメリットあるのかよ",support,political_ideology,高市氏の発言を支持し、政治改革の優先順位を認める
">>864
じゃ、戦争になったら真っ先に若者が戦ってくれるんだね。ありがたやありがたや。",oppose,leadership,若者が戦地へ送ることを侮弄する発言
高市になって 更なる円安が進んで輸入物の価格が爆上がりで生活が苦しくなる 連立解消で半分野党に舵を握られる 米の減産、市場介入しないと米の価格高騰 中国に喧嘩売る トランプ激怒 これのどこが日本がよくなってるのか？ 公明党が与党からいなくなったことくらいか？w 与党にいた方がブレーキになってたか？w,oppose,other_reason,高市が与党入りした結果悪化すると批判
"5万報酬を上げようとして議員削減とか説得力がない
ただ自分達の選挙戦に有利に誘導してるとしか思えないな
これが下げてならまだしも",oppose,leadership,政治的発言に不誠実さを感じ、指導力に懸念を表明
">>869
支持率下げてやれなくて困るね",oppose,leadership,支持率低下を困ったと表現
